{
  "version": 2,
  "command": "prove",
  "ok": true,
  "failed_phase": "",
  "failure": {
    "phase": "",
    "corpus_id": "",
    "artifact_path": ""
  },
  "phases": [
    {
      "id": "selfhost.copy",
      "group": "selfhost",
      "ordinal": 0,
      "status": "passed",
      "artifact": {
        "path": "selfhost",
        "hash": "local-positive"
      }
    }
  ],
  "selfhost": {
    "status": "passed",
    "structural_c_equal": true,
    "artifacts": {
      "workspace_main": {
        "path": "selfhost/main.nq",
        "hash": "local-positive"
      },
      "stage1_c": {
        "path": "build/stage1.c",
        "hash": "local-positive"
      },
      "stage2_c": {
        "path": "build/stage2.c",
        "hash": "local-positive"
      }
    }
  },
  "corpus": {
    "status": "passed",
    "cases": 0,
    "ids": [],
    "artifacts": []
  },
  "tooling": {
    "status": "passed",
    "groups": []
  }
}
